{
  "$schema": "https://json-schema.org/draft/2020-12/schema",
  "title": "Async Research Deliverable Maturity Manifest",
  "type": "object",
  "required": [
    "schema_version",
    "framework_version",
    "maturity_taxonomy",
    "deliverables"
  ],
  "properties": {
    "schema_version": {
      "type": "string",
      "enum": [
        "1.0"
      ]
    },
    "framework_version": {
      "type": "string",
      "enum": [
        "deliverable_maturity_v1.0"
      ]
    },
    "maturity_taxonomy": {
      "type": "array",
      "items": {
        "type": "object",
        "required": [
          "level",
          "id",
          "label",
          "meaning"
        ],
        "properties": {
          "level": {
            "type": "integer",
            "minimum": 0,
            "maximum": 4
          },
          "id": {
            "type": "string",
            "enum": [
              "research_note",
              "internal_draft",
              "shareable_memo",
              "working_paper",
              "submission_ready_manuscript"
            ]
          },
          "label": {
            "type": "string"
          },
          "meaning": {
            "type": "string"
          }
        }
      }
    },
    "deliverables": {
      "type": "array",
      "items": {
        "type": "object",
        "required": [
          "schema_version",
          "framework_version",
          "deliverable_id",
          "title",
          "output_type",
          "target_audience",
          "target_venue",
          "target_maturity",
          "current_maturity",
          "source_task_ids",
          "primary_artifact",
          "owner",
          "required_gates",
          "completed_gates",
          "review_independence",
          "open_gaps",
          "last_reviewed_at",
          "created_at",
          "updated_at"
        ],
        "properties": {
          "schema_version": {
            "type": "string",
            "enum": [
              "1.0"
            ]
          },
          "framework_version": {
            "type": "string",
            "enum": [
              "deliverable_maturity_v1.0"
            ]
          },
          "deliverable_id": {
            "type": "string",
            "pattern": "^DELIV-[0-9]{4}$"
          },
          "title": {
            "type": "string"
          },
          "output_type": {
            "type": "string",
            "enum": [
              "research_note",
              "internal_draft",
              "memo",
              "report",
              "paper",
              "working_paper",
              "manuscript",
              "presentation",
              "other"
            ]
          },
          "target_audience": {
            "type": "string"
          },
          "target_venue": {
            "type": "string"
          },
          "venue_style_profile": {
            "type": "string"
          },
          "target_maturity": {
            "type": "string",
            "enum": [
              "research_note",
              "internal_draft",
              "shareable_memo",
              "working_paper",
              "submission_ready_manuscript"
            ]
          },
          "current_maturity": {
            "type": "string",
            "enum": [
              "research_note",
              "internal_draft",
              "shareable_memo",
              "working_paper",
              "submission_ready_manuscript"
            ]
          },
          "source_task_ids": {
            "type": "array",
            "items": {
              "type": "string",
              "pattern": "^TASK-[0-9]{4}$"
            }
          },
          "primary_artifact": {
            "type": "string"
          },
          "owner": {
            "type": "string"
          },
          "required_gates": {
            "type": "array",
            "items": {
              "type": "string"
            }
          },
          "completed_gates": {
            "type": "array",
            "items": {
              "type": "string"
            }
          },
          "manuscript_gates": {
            "type": "array",
            "items": {
              "type": "object",
              "required": [
                "gate_id",
                "label",
                "category",
                "minimum_maturity",
                "required",
                "status",
                "rationale",
                "waiver_rationale",
                "evidence",
                "updated_at"
              ],
              "properties": {
                "gate_id": {
                  "type": "string",
                  "enum": [
                    "target_audience_declared",
                    "clean_prose_pass",
                    "figures_tables_embedded_and_narrated",
                    "reader_trust_citations",
                    "unresolved_gaps_disclosed",
                    "internal_workflow_source_label_cleanup",
                    "final_prose_pass",
                    "related_work_synthesis",
                    "contribution_statement",
                    "methods_detail",
                    "reproducibility_notes",
                    "formal_limitations",
                    "formal_citations",
                    "complete_bibliography",
                    "target_venue_declared",
                    "venue_style_compliance",
                    "formal_references",
                    "data_code_availability",
                    "figure_table_requirements"
                  ]
                },
                "label": {
                  "type": "string"
                },
                "category": {
                  "type": "string"
                },
                "minimum_maturity": {
                  "type": "string",
                  "enum": [
                    "shareable_memo",
                    "working_paper",
                    "submission_ready_manuscript"
                  ]
                },
                "required": {
                  "type": "boolean"
                },
                "status": {
                  "type": "string",
                  "enum": [
                    "not_required",
                    "missing",
                    "partial",
                    "passed_with_caveats",
                    "passed",
                    "waived_by_human"
                  ]
                },
                "rationale": {
                  "type": "string"
                },
                "waiver_rationale": {
                  "type": "string"
                },
                "evidence": {
                  "type": "array",
                  "items": {
                    "type": "string"
                  }
                },
                "updated_at": {
                  "type": [
                    "string",
                    "null"
                  ]
                }
              }
            }
          },
          "critic_reviews": {
            "type": "array",
            "items": {
              "type": "object",
              "required": [
                "review_id",
                "reviewer_role",
                "independence_type",
                "reviewer",
                "model_or_reviewer",
                "confidence",
                "severity_distribution",
                "recommended_maturity_ceiling",
                "required_revision_rows",
                "review_task_id",
                "artifact_path",
                "status",
                "notes",
                "created_at",
                "updated_at"
              ],
              "properties": {
                "review_id": {
                  "type": "string",
                  "pattern": "^CRITIC-[0-9]{4}$"
                },
                "reviewer_role": {
                  "type": "string",
                  "enum": [
                    "adversarial_critic",
                    "methodology_critic",
                    "external_critic",
                    "human_editorial_critic"
                  ]
                },
                "independence_type": {
                  "type": "string",
                  "enum": [
                    "none",
                    "same_agent_visible",
                    "separate_agent",
                    "different_model",
                    "human",
                    "external"
                  ]
                },
                "reviewer": {
                  "type": "string"
                },
                "model_or_reviewer": {
                  "type": "string"
                },
                "confidence": {
                  "type": "number",
                  "minimum": 0,
                  "maximum": 1
                },
                "severity_distribution": {
                  "type": "object",
                  "properties": {
                    "critical": {
                      "type": "integer",
                      "minimum": 0
                    },
                    "major": {
                      "type": "integer",
                      "minimum": 0
                    },
                    "minor": {
                      "type": "integer",
                      "minimum": 0
                    },
                    "note": {
                      "type": "integer",
                      "minimum": 0
                    }
                  }
                },
                "recommended_maturity_ceiling": {
                  "type": "string",
                  "enum": [
                    "research_note",
                    "internal_draft",
                    "shareable_memo",
                    "working_paper",
                    "submission_ready_manuscript"
                  ]
                },
                "required_revision_rows": {
                  "type": "array",
                  "items": {
                    "type": "string"
                  }
                },
                "review_task_id": {
                  "type": "string"
                },
                "artifact_path": {
                  "type": "string"
                },
                "status": {
                  "type": "string",
                  "enum": [
                    "draft",
                    "completed",
                    "superseded"
                  ]
                },
                "notes": {
                  "type": "string"
                },
                "created_at": {
                  "type": "string"
                },
                "updated_at": {
                  "type": "string"
                }
              }
            }
          },
          "review_independence": {
            "type": "object",
            "required": [
              "minimum_required",
              "achieved",
              "same_agent_review",
              "reviewer",
              "notes"
            ],
            "properties": {
              "minimum_required": {
                "type": "string",
                "enum": [
                  "none",
                  "same_agent_visible",
                  "separate_agent",
                  "different_model",
                  "human",
                  "external"
                ]
              },
              "achieved": {
                "type": "string",
                "enum": [
                  "none",
                  "same_agent_visible",
                  "separate_agent",
                  "different_model",
                  "human",
                  "external"
                ]
              },
              "same_agent_review": {
                "type": "boolean"
              },
              "reviewer": {
                "type": "string"
              },
              "notes": {
                "type": "string"
              }
            }
          },
          "open_gaps": {
            "type": "array",
            "items": {
              "type": "object",
              "required": [
                "gap_id",
                "severity",
                "description",
                "status",
                "source"
              ],
              "properties": {
                "gap_id": {
                  "type": "string"
                },
                "severity": {
                  "type": "string"
                },
                "description": {
                  "type": "string"
                },
                "status": {
                  "type": "string"
                },
                "source": {
                  "type": "string"
                }
              }
            }
          },
          "last_reviewed_at": {
            "type": [
              "string",
              "null"
            ]
          },
          "created_at": {
            "type": "string"
          },
          "updated_at": {
            "type": "string"
          }
        }
      }
    }
  }
}
